{
  "$schema": "http://json-schema.org/draft-07/schema#",
  "title": "Novel Writer Configuration",
  "description": "配置文件 schema，用于 novel-writer-skill 项目",
  "type": "object",
  "required": ["info", "save_location", "writing"],

  "properties": {
    "info": {
      "type": "object",
      "description": "小说基本信息",
      "required": ["name", "type", "status", "created_at", "current_chapter", "written_chapters", "total_words", "current_volume"],
      "properties": {
        "name":      { "type": "string", "description": "小说名" },
        "type":      { "type": "string", "description": "小说类型（玄幻/都市/科幻等）" },
        "status":    { "type": "string", "enum": ["ongoing", "completed", "paused"], "description": "写作状态" },
        "created_at":  { "type": "string", "pattern": "^\\d{4}-\\d{2}-\\d{2}$", "description": "创建日期 YYYY-MM-DD" },
        "current_chapter":  { "type": "integer", "minimum": 0, "description": "当前写到第几章" },
        "written_chapters": { "type": "array", "items": { "type": "integer", "minimum": 1 }, "description": "已写章节编号列表" },
        "total_words":    { "type": "integer", "minimum": 0, "description": "总字数" },
        "current_volume": { "type": "integer", "minimum": 1, "description": "当前卷号" },
        "last_sweet_spot": {
          "type": ["object", "null"],
          "description": "最近爽点；新书未写章节时为 null",
          "properties": {
            "chapter": { "type": "integer" },
            "type":    { "type": "string", "enum": ["装逼打脸", "逆袭反转", "获得机缘", "信息差碾压", "情感满足", "扮猪吃虎"], "description": "爽点 6 类（SKILL.md 爽点类型速查）" }
          }
        },
        "consecutive_no_spot":   { "type": "integer", "minimum": 0 },
        "consecutive_same_type": { "type": "integer", "minimum": 0 },
        "last_hook_start": {
          "type": ["object", "null"],
          "description": "最近章首钩子；新书未写章节时为 null",
          "properties": {
            "chapter": { "type": "integer" },
            "type":    { "type": "string", "enum": ["悬念钩", "冲突钩", "反差钩", "代入钩", "信息差钩", "反转钩", "新信息钩", "新角色钩", "危机钩", "决策钩"], "description": "钩子追踪类 10 个唯一类（SKILL.md 钩子追踪表去重；悬念钩章首/章尾共用）" },
            "strength": { "type": "string", "enum": ["弱", "中", "强"] }
          }
        },
        "last_hook_end": {
          "type": ["object", "null"],
          "description": "最近章尾钩子；新书未写章节时为 null",
          "properties": {
            "chapter": { "type": "integer" },
            "type":    { "type": "string", "enum": ["悬念钩", "冲突钩", "反差钩", "代入钩", "信息差钩", "反转钩", "新信息钩", "新角色钩", "危机钩", "决策钩"], "description": "钩子追踪类 10 个唯一类（SKILL.md 钩子追踪表去重；悬念钩章首/章尾共用）" },
            "strength": { "type": "string", "enum": ["弱", "中", "强"] }
          }
        },
        "consecutive_weak_hooks": { "type": "integer", "minimum": 0 },
        "last_emotion_peak": {
          "type": ["object", "null"],
          "description": "最近情绪峰值；新书未写章节时为 null",
          "properties": {
            "chapter":  { "type": "integer" },
            "emotion":  { "type": "string" },
            "intensity": { "type": "integer", "minimum": 1, "maximum": 10 }
          }
        },
        "consecutive_flat_emotion": { "type": "integer", "minimum": 0 }
      }
    },

    "save_location": {
      "type": "string",
      "enum": ["yuque", "local", "both"],
      "description": "保存位置：yuque=正文/设定存语雀；local=存本地；both=双写（两处都写，读优先本地）"
    },

    "backup": {
      "type": "object",
      "properties": {
        "mode": { "type": "string", "enum": ["yuque_history", "local"], "description": "备份模式" },
        "local_path": { "type": ["string", "null"], "description": "本地备份路径（仅 mode=local 时需要）" }
      }
    },

    "yuque": {
      "type": "object",
      "description": "语雀配置（save_location=yuque/both 时需要；单知识库模式，正文+设定同库）",
      "required": ["book", "groups"],
      "properties": {
        "book": {
          "type": "object",
          "description": "小说知识库标识：book_id 与 namespace 二选一，至少填其一（语雀 API repo 标识两者均可；book_id 用数字 id 或字符串均可）",
          "properties": {
            "book_id":   { "type": ["string", "integer"], "description": "小说知识库数字 ID（与 namespace 二选一；API 接受数字，JSON 里写 123 或 \"123\" 均可）" },
            "namespace": { "type": "string", "description": "小说知识库 namespace（如 yehuoshun/xxx，与 book_id 二选一）" }
          }
        },
        "groups": {
          "type": "object",
          "description": "语雀分组 UUID 映射（22 个固定 key 全必填：content 正文组 + 21 个设定组）",
          "properties": {
            "content": { "type": "string", "description": "正文分组（TITLE，正文章节文档）" },
            "characters_protagonist": { "type": "string" },
            "characters_antagonist": { "type": "string" },
            "characters_supporting": { "type": "string" },
            "characters_deceased": { "type": "string" },
            "items": { "type": "string" },
            "locations": { "type": "string" },
            "factions": { "type": "string" },
            "foreshadowing": { "type": "string" },
            "timeline": { "type": "string" },
            "outline": { "type": "string" },
            "dialogs": { "type": "string" },
            "level_system": { "type": "string" },
            "change_log": { "type": "string" },
            "sweet_spot_tracking": { "type": "string" },
            "hook_tracking": { "type": "string" },
            "detailed_outline": { "type": "string" },
            "emotion_arc": { "type": "string" },
            "world_view": { "type": "string" },
            "mermaid_graph": { "type": "string" },
            "snapshot": { "type": "string" },
            "changes": { "type": "string" }
          },
          "required": ["content", "characters_protagonist", "characters_antagonist", "characters_supporting", "characters_deceased", "items", "locations", "factions", "foreshadowing", "timeline", "outline", "dialogs", "level_system", "change_log", "sweet_spot_tracking", "hook_tracking", "detailed_outline", "emotion_arc", "world_view", "mermaid_graph", "snapshot", "changes"]
        }
      }
    },

    "local": {
      "type": "object",
      "description": "本地存储配置（save_location=local/both 时需要）",
      "properties": {
        "content_path": { "type": "string", "description": "正文保存路径（统一格式：./小说名/正文；相对路径以运行 cwd 为基准）" },
        "settings_path": { "type": "string", "description": "设定保存路径（统一格式：./小说名/设定；相对路径以运行 cwd 为基准）" }
      }
    },

    "writing": {
      "type": "object",
      "description": "写作设定",
      "required": ["pov", "perspective", "style", "narrative_style", "chapter_words"],
      "properties": {
        "pov":  { "type": "string", "enum": ["first-person", "third-person"], "description": "人称" },
        "perspective": { "type": "string", "enum": ["single", "multi"], "description": "视角" },
        "style": { "type": "string", "description": "文风（classical/modern/humorous/serious 等）" },
        "narrative_style": { "type": "string", "description": "叙事节奏（fast-paced/slow-burn/detailed 等）" },
        "dialogue_style": { "type": "string", "enum": ["quoted", "unquoted"], "description": "对白体例：quoted=引号体；unquoted=「说，…」无引号体（写章节前须对照本书近 1-2 章正文确认）" },
        "chapter_words": {
          "type": "object",
          "required": ["min", "max"],
          "properties": {
            "min": { "type": "integer", "minimum": 1000, "description": "每章最少字数" },
            "max": { "type": "integer", "minimum": 1000, "description": "每章最多字数" }
          }
        }
      }
    }
  },

  "allOf": [
    {
      "description": "save_location=yuque 或 both 时需要 yuque 字段",
      "if": { "properties": { "save_location": { "enum": ["yuque", "both"] } } },
      "then": { "required": ["yuque"] }
    },
    {
      "description": "save_location=local 或 both 时需要 local 字段",
      "if": { "properties": { "save_location": { "enum": ["local", "both"] } } },
      "then": { "required": ["local"] }
    },
    {
      "description": "backup.mode=local 时 local_path 必填",
      "if": { "properties": { "backup": { "properties": { "mode": { "enum": ["local"] } } } } },
      "then": { "properties": { "backup": { "type": "object", "required": ["local_path"] } } }
    },
    {
      "description": "save_location=yuque 时 backup.mode 只能是 yuque_history（语雀存储不做本地备份）",
      "if": { "properties": { "save_location": { "enum": ["yuque"] }, "backup": { "properties": { "mode": { "enum": ["local"] } } } } },
      "then": { "properties": { "backup": { "type": "object", "properties": { "mode": { "enum": ["yuque_history"] } } } } }
    }
  ]
}
