{
  "$schema": "config.schema.json",
  "info": {
    "name": "青云剑歌（测试）",
    "type": "玄幻",
    "status": "ongoing",
    "created_at": "2026-10-09",
    "current_chapter": 3,
    "written_chapters": [
      1,
      2,
      3
    ],
    "total_words": 3533,
    "current_volume": 1,
    "last_sweet_spot": {
      "chapter": 3,
      "type": "装逼打脸"
    },
    "consecutive_no_spot": 0,
    "consecutive_same_type": 0,
    "last_hook_start": {
      "chapter": 3,
      "type": "悬念钩",
      "strength": "强"
    },
    "last_hook_end": {
      "chapter": 3,
      "type": "悬念钩",
      "strength": "强"
    },
    "consecutive_weak_hooks": 0,
    "last_emotion_peak": {
      "chapter": 3,
      "emotion": "震撼",
      "intensity": 8
    },
    "consecutive_flat_emotion": 0
  },
  "save_location": "yuque",
  "backup": {
    "mode": "yuque_history",
    "local_path": null
  },
  "yuque": {
    "book": {
      "book_id": "84369821",
      "namespace": "yehuoshun/novel-writer-mv0kccrz"
    },
    "groups": {
      "content": "kBiTZD2Rs4fOTyK_",
      "characters_protagonist": "8BKEAe3S6n-xQ4uz",
      "characters_antagonist": "qheeBLAhuqbHYFP2",
      "characters_supporting": "Z2q_V_zm7BJpIPsD",
      "characters_deceased": "ErubWarwrwnZ75w8",
      "items": "L9M9imxHBW9JL3yf",
      "locations": "HJCpmzHrbqsy5wFc",
      "factions": "uLjlEbrWvWuGydC2",
      "foreshadowing": "2R6KofLwH6iI9rta",
      "timeline": "KeCzt11bkVyeB8WV",
      "outline": "PCI5ft3-c-Wb9CaZ",
      "dialogs": "CzU3wxl0HkVUchKR",
      "level_system": "eMHdPNUbiwlT5ieD",
      "change_log": "eQp9k_pYmjv5BXrg",
      "sweet_spot_tracking": "vNqXGtE_0cFg9BpT",
      "hook_tracking": "3puEJqRcjLQoLWrn",
      "detailed_outline": "XWIwZh53UnnAOozO",
      "emotion_arc": "obFqBBwL0PzP-zmb",
      "world_view": "tOZUvTHej6GD_Ta9",
      "mermaid_graph": "K9IXOKW94es1SYF3",
      "snapshot": "mS-VgWXehBub8ABH",
      "changes": "LJaNj4JM9gl_tYbn"
    }
  },
  "writing": {
    "pov": "third-person",
    "perspective": "single",
    "style": "classical",
    "narrative_style": "fast-paced",
    "chapter_words": {
      "min": 1500,
      "max": 2500
    }
  }
}
