{
  "info": { "name": "剑歌2", "type": "玄幻", "status": "ongoing", "created_at": "2026-10-09",
    "current_chapter": 0, "written_chapters": [], "total_words": 0, "current_volume": 1 },
  "save_location": "local",
  "local": { "content_path": "./剑歌2/正文", "settings_path": "./剑歌2/设定" },
  "writing": { "pov": "third-person", "perspective": "single", "style": "classical",
    "narrative_style": "fast-paced", "chapter_words": { "min": 2000, "max": 4000 } }
}
